title,heading,content,token
Ewha Womans University Introduction,About Ewha,"Ewha Womans University is a private research university for women in Seoul, South Korea. Founded in 1886, it is the oldest and largest women's university in South Korea. Ewha is a comprehensive university with 11 colleges and 13 graduate schools offering over 100 undergraduate and graduate programs. The university is known for its strong academic programs, especially in the fields of humanities, social sciences, and natural sciences. Ewha also has a strong reputation for its international programs and has exchange agreements with over 300 universities around the world.",113
Ewha Womans University Rankings,World University Rankings,"Ewha Womans University is ranked among the top universities in Asia and the world. In the 2023 QS World University Rankings, Ewha is ranked 101-150th in the world and 1st in South Korea. In the 2023 Times Higher Education World University Rankings, Ewha is ranked 151-200th in the world and 1st in South Korea.",83
Undergraduate Admissions,Requirements,"Applicants must have a high school diploma or equivalent.
Applicants must submit their academic transcripts, standardized test scores (such as SAT or ACT), and letters of recommendation.
Applicants must also write an essay and submit a personal statement.
The specific requirements for each program may vary, so it is important to check with the university for more information.",69
